subreddit,post_id,post_title,post_score,poster_username,comment_id,parent_id,commenter_username,comment_body,comment_score,reply_to
changemyview,199unuw,CMV: The MAGA crowd is a cult full of hate,0,Overall-Put-1165,kihwn07,t3_199unuw,baltinerdist,"I'm going to caveat this with a huge disclaimer: I am a registered Democrat, a politics junkie (I subscribe to \~4 political podcasts), and a total liberal. 

I believe the culture of the MAGA movement is one that is based on hate, if only because the policies espoused by the leaders in the movement (Trump, Bannon, Tucker, Hannity, etc.) are usually based on in-group/out-group ethics where the out groups tend to be minorities, the poor, LGBTQ+ people, anyone not Evangelical (with a carveout for Israel), and so forth. And when all your policies are designed to harm those out groups, that can't really be described as anything but hate.

That said, I believe there are three groups of people at play in the MAGA movement, and I believe group three is where I'd like to change your view.

First, there are the leaders who are in it to enrich themselves and grift the people below them. This would include Trump, Hannity, Tucker, and so forth. They may have mildly hate-filled views, but they aren't actually there *because* of the hate, they're there because the hate sells. If it gets them power, it gets them money, and that's their core motivation in life.

Second, there are a mix of leaders and followers who are genuinely hateful people. This would go for Bannon, Stephen Miller, Fuentes, and so forth, plus a subset of constituents who are hateful people and like that they are being given a permission structure in which to freely hate. These are people who genuinely believe that non-white, non-straight people are inferior and should have all the power of the state brought to bear to oppress them.

Third and finally, there are the remainder which I believe is a majority of Republican voters today. These people are not specifically hate-filled. These are the bystanders that watch a mob lynch an innocent man and don't specifically cheer or grab the rope but also don't do anything to stop them. I don't think any of them would take active steps to harm a minority, a member of the LGBTQ+, someone with a disability, a Muslim or an atheist, etc. I would say these are the people that would quickly say ""No, I'm not racist, I have a black friend."" 

I don't think these people have the same hate as the first (playacted) or second (genuine) groups. It is absolutely the case that their political action -- that is, voting for the Republican party -- empowers hateful actions to take place through policy and sometimes actual state action (kids in cages, etc.). But none of them, given the opportunity, would grab the arm of a brown child and rip them away from their parent at the border. In fact, they might feel a bit of shame if they were in proximity to it being done.

It is the distance, in fact, that keeps the shame away. They don't happen to know a gay couple and they might turn their nose up at it, but it's not like *they* would go protest a gay wedding. They've seen the textbooks and *they* would never be the ones screaming at Ruby Bridges as she tries to walk into the school in Little Rock.

I don't know that I could effectively articulate what it is that they are filled with that isn't hate. Perhaps it's more a lack of empathy, or an abundance of apathy, or an ample dose of denial. If there is any hate there, it's more a byproduct of the above.

I think it's easy to see the rallies and the marches and the MAGA hats and see a nation half-full of abhorrent people. But I'd be willing to bet the average Trump voter filling up their gas tank in Tuscaloosa, Alabama isn't daily or even monthly engaging in activities of harm toward their fellow man. Just once or twice a year, they pull a lever to give rise to the people that do, for a myriad of reasons that aren't the subject of your CMV.",1,199unuw
changemyview,199unuw,CMV: The MAGA crowd is a cult full of hate,0,Overall-Put-1165,kihd8ur,t1_kigxwqs,gimmecoffee722,"I am conservative and I approve this message. I remember when trump first came out and started saying things that had never been said out loud before against the dems and it was refreshing, to say the least. He was saying the things we all said but we didn’t have a voice. He was our voice. Hillary could call us all deplorables but God forbid Romney be a Mormon. Biden is actually a racist but that doesn’t matter to the Dems because they’re just louder than us.",8,kigxwqs
changemyview,199unuw,CMV: The MAGA crowd is a cult full of hate,0,Overall-Put-1165,kigqg7s,t1_kigo8ax,thatsnotfunnyatall_,Add: more Hate. Everyone without my opinion is a homophobe Transphobe racist. Thanks I forgot those too.,4,kigo8ax
changemyview,199unuw,CMV: The MAGA crowd is a cult full of hate,0,Overall-Put-1165,kihxvmb,t1_kihvr2o,JaiC,"The Bible one is interesting. I'm not convinced it changes the fact that he did fascism on the way to the church, so mild praise at best, congratulations on holding a Bible right-side up? I guess?  

The dude has a rap sheet that's literally hundreds of pages long, a few things over the past decade being slightly wrong or misinterpreted doesn't like, make  him not a Nazi? Like, that's not how that works?  And you know that?  So I don't really believe this is good faith?

You(yes you) even agree he's  ""a kleptocrat, an oligarch, a xenophobe, a racist, even an authoritarian"" so quibbling over the f-word seems a bit extraneous, doesn't it?",0,kihvr2o
changemyview,199unuw,CMV: The MAGA crowd is a cult full of hate,0,Overall-Put-1165,kigthkx,t1_kigmjdu,endless_sea_of_stars,"You are intentionally misrepresenting the quote.  Let me give you the full quote.

> You know, to just be grossly generalistic, you could put half of Trump's supporters into what I call the basket of deplorables. (Laughter/applause) Right? (Laughter/applause) They're racist, sexist, homophobic, xenophobic, Islamophobic – you name it. And unfortunately, there are people like that. And he has lifted them up. He has given voice to their websites that used to only have 11,000 people – now have 11 million. He tweets and retweets their offensive hateful mean-spirited rhetoric. Now, some of those folks – they are irredeemable, but thankfully, they are not America.

> But the ""other"" basket – the other basket – and I know because I look at this crowd I see friends from all over America here: I see friends from Florida and Georgia and South Carolina and Texas and – as well as, you know, New York and California – but that ""other"" basket of people are people who feel the government has let them down, the economy has let them down, nobody cares about them, nobody worries about what happens to their lives and their futures; and they're just desperate for change. It doesn't really even matter where it comes from. They don't buy everything he says, but – he seems to hold out some hope that their lives will be different. They won't wake up and see their jobs disappear, lose a kid to heroin, feel like they're in a dead-end. Those are people we have to understand and empathize with as well.",-1,kigmjdu
changemyview,199unuw,CMV: The MAGA crowd is a cult full of hate,0,Overall-Put-1165,kih6n7l,t1_kih404y,FuckChiefs_Raiders,"Let me preface this that I don't support all of these viewpoints nor am I even a Trump supporter. However, it's important to understand where others are coming from instead of just labeling them morons/racists/gullible/etc. 

Immigration- The US/Mexico border is a complete disaster right now. Millions of illegal immigrants are entering the country every single year and we literally can't support them and have no idea what to do with them. He wants to be stronger on immigration. 

China- He wants to restrict the Chinese influence in our economy, and ban them from being able to invest in American infrastructure; notably Energy, Tech, Telecommunications, etc. 

2A- I don't really need to expand on this. 2A supporters feel this is their intrinsic right, and I'm sure you have heard the ""shall not be infringed"", he wants to protect that. 

Just these 3 items are hills that some Republicans are willing to die on, and Trump is that person who wants to give it to them. Just like many Democrats are willing to die on the hill of Abortion, LGBT Rights, and gun violence.",3,kih404y
changemyview,199unuw,CMV: The MAGA crowd is a cult full of hate,0,Overall-Put-1165,kihal2x,t1_kih9kqy,FuckChiefs_Raiders,"Then don't vote for him, but these are the things he is campaigning on. But it's so disingenuous to say that all Trumpers are morons and gullible and racist. There are some legitimate policy reasons some may want to vote for Trump. 

Again, I'm not a supporter, just at least trying to get people to understand it's not good vs bad or dumb vs smart like most people on this platform think. 

There are a TON of people on this site that feel a sense of superiority and intelligence because they don't like Trump. I feel that is strange.",2,kih9kqy
changemyview,199unuw,CMV: The MAGA crowd is a cult full of hate,0,Overall-Put-1165,kiiw9j3,t1_kiivmwq,direwolf106,"That sounds like “I’m not racist, I have a black friend”. 

I have no doubt you can regurgitate conservatives talking points. I do doubt you understand why conservatives take the stances they do. Why would someone that isn’t gullible, dumb, or hateful choose to vote with trump come hell or high water?

If you default to any buzz democrats love or one that’s insulting then you don’t understand it.",2,kiivmwq
changemyview,199unuw,CMV: The MAGA crowd is a cult full of hate,0,Overall-Put-1165,kilwuzj,t1_kilq9ae,olidus,"I apologize in advance for the length, but you brought up some good points I feel the need to address at length. I hope you consider them all.

Pointing it out shows that people have options:

1. vote/ advocate
2. run for election
3. move

You hold a minority view in a majority opposition area. A representative government cannot represent all positions on a given issue. You don't have to like it, but to suggest it is an indictment of the opposition party is reductive. If you value your positions more than the majority in which you are surrounded by, the only logical recourse then is to move. If you think SF is ""leftist absurdity"", then you likely share common values with places that institute ""rightist absurdity"".

As far as your indictment of higher education, I see your talking points and know very well where they come from, so I will address them:

1. Let's not forget that the discrimination in admission scandal was because Harvard's methods suppressed the chance of Asian-American candidates being accepted, in favor of white, hispanic, and black candidates. This demonstrated inherent bias in qualitative measuring of student attributes. They were wrong because such bias violates federal law, but not for the reasons you suggest, unless you are suggesting that Asian American suppression is the goal of ""the Left"".
2. The student letter did not voice support for Hamas. It blamed Israel for the attack, the rise of Hamas, and called to end the slaughter of innocent Palestinians. Yes, naive and oversimplification of the conflict, but protected speech nonetheless. The talking heads that suggest Harvard was protecting students who voiced support for a terrorist organization is equally appalling as is labeling anything that challenges Israel's policies, actions, and methods as ""anti-semetic"".
3. While you may find edge cases of bullying happening on that campus, the only things I have seen are protests and counter protests amping each other up and incidents of anti-semitism. I propose that there are anti-semites in a lot of spaces in the U.S., same as racists hanging bananas or posting pictures of monkeys at black fraternities. These do not serve as examples of an institution's support for horrid behavior. Every institution has policies in place to investigate and prosecute with prejudice this type of behavior, but that would not serve the narrative. I have yet to see one case where a student alleges bullying that has not been addressed by any academic institution. But the headline remains.
4. Abysmal free speech rating, I somehow knew this was coming:

As irrelevant as it is to your topic, the FIRE’s College Free Speech Rankings are a self congratulating Republican echo chamber funded by the Charles Koch Institute, right winger Richard Mellon Scaife's estate, and the Bradley Foundation (conservative anti-public education group).

  
But, to address your concerns of Harvard's low rankings, lets examine why they got such a horrible score (according to FIRE):

They ""sanctioned"" 4 scholars (3 terminated) (two were denied Tenure by their peers not fired, one resigned after news caught ahold of his post that suggested ""90%+ of the Black students at Williams (another ""elite"" university) would not have been admitted were it not for their Black’ness"" (but FIRE classified is as ""forced to resign""), the last was the Dean of the Law school taking on a high profile client (Defending Harvey Weinstein) instead of focusing on being a Dean, but again, FIRE represents it as a suppression of ideological free speech.

  
Revoked an admission offer to a high schooler that made repeated racists private texts

  
Disinvited an invited guest speaker for questionable ties to an anti-trans Non-profit

  
Had an economic talk protested by students.

  
**None** of this represents that Harvard is ""anti-free speech"".

  
For the employees, they know they can speak and write as citizens but those words and actions reflect upon their employer and you can be fired for them if it affects the institution. It has nothing to do with ""free speech"" when you post lies or misinformation, especially when they use their association with Harvard to legitimize their platform. But again, none of the employees were ""fired"" for their speech.  
For prospective students, Harvard is a very selective institution. If you give them a reason to not admit you, there are 50,000 other students who are equally academically capable students who did not make problematic comments when they thought no one else was listening. I find it humorous that FIRE frames the student in question as, ""Parkland, Fla. school shooting survivor and gun rights activist Kyle Kashuv"" instead of the more accurate ""Kashuv, the right winger who considers black people ""jewish slaves"" and ""niggerjocks"" (actual statements he wrote and were the reason that Harvard considered the student not as attractive as at least one of the other 50K).  
I am an advocate of the freedom of speech. However, that right is only granted by the constitution to guarantee that the government does not infringe upon our right to speak out against the government. Not a private institution and surely not private institutions that we all voluntarily agree to be a part of. However, most academic institutions go to great lengths to protect speech.

  
All of that to say FIRE is garbage, but if you follow FIRE's logic, they should stand steadfastly behind Gay being able to say that the horrendous speech, even that written in the letter from the students, is technically protected.

There are plenty of conservative academics. They tend to be less divisive and focus on their job: research and teaching, but every now and then, they make headlines for problematic views as well while the moderates just shake their heads. But hey, lets purity test conservatives and if we don't agree with their moderate take on a given position, lets just call them RINOs.",1,kilq9ae
changemyview,199unuw,CMV: The MAGA crowd is a cult full of hate,0,Overall-Put-1165,kiiy55v,t1_kiiw9j3,LucidMetal,"Because obviously they're not voting for Trump but against Biden. That's just our shitty plurality system. 

There's something wrong with being racist. There's nothing wrong with being biased against politically opposed views. I won't deny I'm opposed to conservative views.

Buzz? I'm not dem by the way.",1,kiiw9j3
politics,5blmi4,I Was With Bernie Till the End; Now We All Must Vote Hillary,1661,Denise422,d9q978q,t1_d9pf9as,dumkopf604,"Have you been called racist, bigoted or misogynistic lately?",5,d9pf9as
politics,5blmi4,I Was With Bernie Till the End; Now We All Must Vote Hillary,1661,Denise422,d9pm9ir,t1_d9plpy5,Zerakin,"Warning if anyone tries to recommend /r/uncensorednews. They are run by ex mods of fascist and alt-right subs. One of the mods bragged about it becoming the new /r/European (I think that was the name?), which was heavily racist.

Edit: Forgot the 's' in fascist. Thanks /u/Pickled_Kagura!",84,d9plpy5
politics,ez1i5x,"[Discussion] State of the Union, 9 pm EST",0,dottiemommy,fgko9el,t3_ez1i5x,coffee_andcigarettes,We've got all the brown people tonight. Trump is obviously not racist! /s,33,ez1i5x
politics,ez1i5x,"[Discussion] State of the Union, 9 pm EST",0,dottiemommy,fgkoc87,t1_fgkne7v,Taint_my_problem,"“I’m a lying, unqualified, draft dodging, gold star family disrespecting, POW attacking, US General insulting, racist, sexist, vulgar, confirmed sexual assaulting, trillion dollars to the rich tax cutting, own daughter creeping, wife cheating with a pornstar after birth of son and paying for campaign-finance-violating silencing, $413 million dollar inheritance getting, teen pageant dressing room invading, baby and mother separating, breast feeding mother shaming, fat-shaming while being fat, 17 women accusing him of sexual assaulting, accusers are not attractive enough for him to assault implying, university student defrauding, bankrupt casino causing, kids cancer charity stealing, taped detailed accusation of rape of a minor having, wife-beating, popular vote losing, anti-vaxxing, Christianity-faking, publicist impersonating, tax dodging, friends’ wives pursuing, impeached, foreign aid bribing, 1/3 of the presidency golf playing, “enemy of the people” free-press assaulting, Hannity coordinating, Cambridge Analytica using, Ivanka is a “piece of ass” approving, loan application asset inflating, historically low polling, college achievement faking, unqualified judge appointing, unqualified cabinet member appointing, 9/11 victims funds immorally accepting, Christianity Today verbal-thrashing receiving, chronically-ill infant nephew inheritance cutting then medical coverage canceling, criminals Flynn Cohen Manafort Papadopolous and Stone hiring, foreign influence on our election welcoming, tax release avoiding, birther conspiracy spreading, Ukraine ambassador targeting, Russian money taking, Kurdish ally abandoning, soldier brain injury downplaying, full morning “executive time” taking, Epstein befriending, Putin bowing, Kim Jong Un praising, North Korean general saluting, US intelligence denying, tallest building in lower Manhattan after 9/11 boasting, congress obstructing, nuclear non-proliferation deal ending, Justice obstructing, unqualified daughter and son-in-law appointing, healthcare cut targeting, pedophile candidate supporting, trump tower Moscow denying, mail-bomber inspiring, 4 out of top 5 largest protests in US history causing, green energy stifling, clean water regulation destroying, healthy school lunch ending, climate change denying, congressional and judicial branch attacking, economy does better under democrats saying, Goldman Sachs appointing, food stamp removing, emissions standards lowering, press conference avoiding, emoluments clause breaking, longest govt shutdown record holding, Saudi Arabia nuclear tech selling, golf cheating, time magazine cover faking, El Paso mass shooter inspiring, paying legal bills for roughing up protestors promising, killed soldier “knew what he signed up for” saying, pardon abusing, economy false-claiming, scumbag.”

GOP stands up and applauds.

[Sources](https://www.reddit.com/r/politics/comments/eva5pe/wallace_trumps_approval_of_pompeos_abusive/ffuf0jp/?utm_source=share&utm_medium=ios_app&utm_name=iossmf)",237,fgkne7v
politics,ihw8s2,Discussion Thread: Day 4 of the 2020 Republican National Convention 8-27-2020,0,PoliticsModeratorBot,g33mrvd,t3_ihw8s2,TheBlueBlaze,"Jake Tapper pointing out how absurd a commonality with the RNC was: ""I wish you could see how he was behind the scenes""

> People say he's racist and they go ""No he's not! He loves black people!"" People say he's selfish and they go ""No he's really caring and selfless!"" People say he hates immigrants and they go ""No he's not, here he is naturalizing citizens!"" They are trying to make it seem like Trump is not the person the people have seen him to be.",68,ihw8s2
politics,ihw8s2,Discussion Thread: Day 4 of the 2020 Republican National Convention 8-27-2020,0,PoliticsModeratorBot,g339g2k,t3_ihw8s2,EasyMoney92,"This is designed to maximize turnout from non college educated white people. They've given up on appealing to moderates and people of color. They're pretending that 185,000+ people haven't died from Covid. The POC speakers aren't trying to convince other POC to vote for Trump; they're trying to convince non college educated white voters that ""Trump isn't really racist, and it's okay to vote for him"".",37,ihw8s2
politics,ihw8s2,Discussion Thread: Day 4 of the 2020 Republican National Convention 8-27-2020,0,PoliticsModeratorBot,g33uhp1,t3_ihw8s2,IamnotHorace,"RNC

Biden supported the 1994 Crime Bill therefore he is racist.

Biden is weak on crime and you will be at risk of he is elected because he doesn't support Law and Order.

Pick one.",37,ihw8s2
politics,57buyp,"Hi Reddit, I am Maria Teresa Kumar, Emmy-nominated contributor with MSNBC and founder of Voto Latino. Ask me anything!",55,MariaTeresaKumar,d8r36qz,t3_57buyp,[deleted],Thank you for doing this and for dealing with all the racists comments by redditors who are racists or willfully blind to their racism.,1,57buyp
politics,57buyp,"Hi Reddit, I am Maria Teresa Kumar, Emmy-nominated contributor with MSNBC and founder of Voto Latino. Ask me anything!",55,MariaTeresaKumar,d8rib2h,t1_d8r0nh5,Fearsomeman3,Probably the same reason Trump made his little party of racists that support the genocide of anyone with different ideals and creeds hence your username. ,1,d8r0nh5
politics,57buyp,"Hi Reddit, I am Maria Teresa Kumar, Emmy-nominated contributor with MSNBC and founder of Voto Latino. Ask me anything!",55,MariaTeresaKumar,d8qoa86,t1_d8qm06h,MariaTeresaKumar,"None - he's a racist, misogynist, and the poster boy for white male privilege. No other candidate - female or person of color would have been able to get this far - besides the fact that he has no actionable policies. ",45,d8qm06h
politics,57buyp,"Hi Reddit, I am Maria Teresa Kumar, Emmy-nominated contributor with MSNBC and founder of Voto Latino. Ask me anything!",55,MariaTeresaKumar,d8r897j,t1_d8qr60r,[deleted],"and that is racist how exactly? 

You're proving her point, if only there was some kind of basket to put you deplorables in.",2,d8qr60r
politics,57buyp,"Hi Reddit, I am Maria Teresa Kumar, Emmy-nominated contributor with MSNBC and founder of Voto Latino. Ask me anything!",55,MariaTeresaKumar,d8r0s42,t1_d8r0b29,Jorke550,"¿Qué acaso vas a ignorar el grupo demográfico que demoniza al llamar a todos los ilegales violadores y asesinos? 

Todo el que dice que lo que dijo Trump no es racista esta intencionalmente ignorando el gran porcentaje de latinos incluido en el grupo de el que habla. ",1,d8r0b29
politics,57buyp,"Hi Reddit, I am Maria Teresa Kumar, Emmy-nominated contributor with MSNBC and founder of Voto Latino. Ask me anything!",55,MariaTeresaKumar,d8ru36h,t1_d8r897j,highlyven0m0us,"It's a group specific to a single race excluding all others; pretty much textbook racism.  It's really not that hard to understand unless your suffering from some extreme cognitive dissonance.  

If I made a group called ""Vote White"" that would be undeniably racist right?  So why would it not be racist if you replace white with any other race?

Replace basket with ""internment camp"" because we all know thats what Hillary would do if she could get away with it and people like you would support it.  ",1,d8r897j
politics,57buyp,"Hi Reddit, I am Maria Teresa Kumar, Emmy-nominated contributor with MSNBC and founder of Voto Latino. Ask me anything!",55,MariaTeresaKumar,d8qo0ti,t1_d8qnxkn,ArchonForTrump,"Apparently it's only racist when Americans want a border wall, not when Mexico does.",1,d8qnxkn
politics,57buyp,"Hi Reddit, I am Maria Teresa Kumar, Emmy-nominated contributor with MSNBC and founder of Voto Latino. Ask me anything!",55,MariaTeresaKumar,d8qomra,t1_d8qogkv,_mariomariomario_,"It's racist when those voter ID laws target people of color specifically, and then claim it's to prevent voter fraud, when voter fraud is absolutely minimal. When proof is asked for voter fraud, there appears to be none. ",2,d8qogkv
politics,635y4,Ron Paul Tea Party $$$ Now More Than The Nov 5 Money Bomb. Eight Hours Left.,0,Flemlord,c02oo8c,t3_635y4,loquacious,"You guys are wasting your money.

Ron Paul is never going to get on the Republican ballot.

The Electoral College isn't going to vote for him no matter how many of you ""citizens"" vote for him.

And he's a creepy fascist, a racist and an isolationist - so the vast majority of us that are still sane and not sucking his dick aren't going to vote for him either.

And if - by some freakish accident - you little Boy Scouts manage to actually vote him  into office - well, you'll deserve the government you get.

It's going to suck. A lot. It's going to make Bush look like a sane moderate.",-8,635y4
