subreddit,post_id,post_title,post_score,poster_username,comment_id,parent_id,commenter_username,comment_body,comment_score,reply_to
conspiracy,wkua4m,"Meet the ""judge"" that signed Trump's search warrant.......",405,BC-Wales,ijqe9mz,t3_wkua4m,TheyCallMeLotus0,Clearly eating vanilla Oreos double stuffed with whiteness makes you a racist.,2,wkua4m
conspiracy,wkua4m,"Meet the ""judge"" that signed Trump's search warrant.......",405,BC-Wales,ijrlfzd,t3_wkua4m,TheFooPilot,Dudes so racist he eats white oreos,2,wkua4m
conspiracy,wkua4m,"Meet the ""judge"" that signed Trump's search warrant.......",405,BC-Wales,ijprjmy,t1_ijpmthi,[deleted],"Monday: ""the left calls anyone who doesn't agree with them a racist!""

Tuesday: ""literally everyone I don't like is a pedophile""",91,ijpmthi
conspiracy,wkua4m,"Meet the ""judge"" that signed Trump's search warrant.......",405,BC-Wales,ijqcnfg,t1_ijq10ay,[deleted],Racist cookie confirmed.,24,ijq10ay
conspiracy,wkua4m,"Meet the ""judge"" that signed Trump's search warrant.......",405,BC-Wales,ijqk24h,t1_ijqcnjd,DependentTreacle8,"And once again the real conspiracy is in the comments, What does he have against regular Oreos? preference in taste? Not likely Must be a racist",7,ijqcnjd
conspiracy,yzr2xe,It’s official MAGA is the Majority on Twitter! That’s why the Left had to censor us. The Left was losing the Culture War so they had to resort to Censorship! This poll speaks volume.,148,2201992,ix22fuh,t3_yzr2xe,elitedejaguar,"The dems are ruling againts the people to drive and enforce a failed neoliberal system that was designed to facilitate, corrupt, seperate and enslave the people all over the world.

The best you got right now is Trump just like Mexico has AmLO and Brazil got Lula etc. What do they have in common, they want what the people want and they are a reflection of the people.

USA is racist, Europe is classist and just like the rest of the world they too are corrupt but they dont admite it and untill they admit the relityof what they are they will never move forward in will be stuck in how they been till this day.

Make a change for a better place, for you for me and the rest of the human race - MJ",-3,yzr2xe
conspiracy,yzr2xe,It’s official MAGA is the Majority on Twitter! That’s why the Left had to censor us. The Left was losing the Culture War so they had to resort to Censorship! This poll speaks volume.,148,2201992,ix1w6c0,t1_ix1n72q,[deleted],"It’s just super funny, you weren’t saying that two years ago, Biden was supposed to be your saving grace, make the world a better place. At least with trump unemployment was lowest ever, housing was affordable, jobs paid well, and taxes reduced. But no, mean tweet bad, orange man racist. Just admit you were wrong, and take some damn responsibility for your actions. The whole “every politician is bad!” Is a terrible deflection tactic, y’all fucked up really",-41,ix1n72q
conspiracy,wl9588,Everyone knows Joe Biden and Harris was Carried and Propped up through a Stolen Presidential Election. You know it. They know it. We all know it.,389,SilentConsciou5,ijsogru,t1_ijsie2f,Icy-Tap8749,But voter ID is racist,6,ijsie2f
conspiracy,wl9588,Everyone knows Joe Biden and Harris was Carried and Propped up through a Stolen Presidential Election. You know it. They know it. We all know it.,389,SilentConsciou5,ijsw30z,t1_ijsj6fk,Schwinston123456,"... and you nominated Biden, an old, racist white man who has a history of sexual assault allegations, to ""restore the soul of America"". Joke of a party.",0,ijsj6fk
conspiracy,wl9588,Everyone knows Joe Biden and Harris was Carried and Propped up through a Stolen Presidential Election. You know it. They know it. We all know it.,389,SilentConsciou5,ijszaex,t1_ijsogru,Adversion8643,except for driving library cards getting a job going to school leaving the country flying on an airplane buying a car getting welfare getting unemployment etc. then it's not racist. and ID is only racist when we want to prevent voter fraud..,4,ijsogru
conspiracy,wl9588,Everyone knows Joe Biden and Harris was Carried and Propped up through a Stolen Presidential Election. You know it. They know it. We all know it.,389,SilentConsciou5,ijsxn88,t1_ijsucuh,Whatisthisisitbad,">Or they painted him in that light since he got into politics. Clearly they’ve done that. Not a lot of complaints before that, raised decent kids, was a successful business man… 

Hmm.  Where are you from/how old are you?  Because he's always been a loud mouth narcissistic spotlight seeking conman.  Was in billions in debt by the early 90s.  Stiffed hundreds if not thousands of workers, contractors, architects, etc.  Mob adjacent.  All of it.

And that's all before 2011, when he made his second break into politics (campaign in 1999 never took off) by saying racist shit about Obama, and how he has Obama's REAL birth certificate - which of course he never produced because he's a fucking liar.

He's been a greedy narcissist xenophobic conman since time immorium, wether you are aware of it or not.  

There is one thing he has always been really really good at though - playing the victim and suing people.  No surprise he managed to convince so many people the media was out to get him.",4,ijsucuh
conspiracy,wl9588,Everyone knows Joe Biden and Harris was Carried and Propped up through a Stolen Presidential Election. You know it. They know it. We all know it.,389,SilentConsciou5,ik37pwf,t1_ik2xaa7,Key_Panda_9209,"He was impeached in the house by a democrat majority twice. Doesn’t really mean anything just that the party was after him. Witch-hunt, kangaroo court bs

Edit: Covid response. Inarguably an unprecedented event. The medical authorities have proven corrupt. Trump was one to suggest treatment options for Covid that arguably work but we’re suppressed to EUA vaccines…he tried to shut down travel and was labeled a racist…lol…Id like to know what you think should have been done better",2,ik2xaa7
conspiracy,z0os37,Trump got 87.1 million followers in less then a day after being unbanned from Twitter. Meanwhile Biden only has 27.6 million followers. There is no way Biden got 80 million votes.,1013,2201992,ix70rt4,t3_z0os37,Scale-Alarmed,"""But we had parades, Rallies, Boat Paradies, F.U. Biden signs, Shirts, Hats, Old Racist White Folk, Truck Convoys.........AND WE STILL LOST!!""",15,z0os37
conspiracy,krvjzk,BREAKING: They have BREACHED the Capitol Building...Protestors INSIDE...LIVE RIGHT NOW,24,axolotl_peyotl,gicf1ye,t1_gicdv6b,Sleepy_Bob_Ross,"Uhhh the Patriots in the capitol haven't burned down any communities. 

The BLM shit was pure violence and racist little kids who burned down whole cities.",7,gicdv6b
conspiracy,krvjzk,BREAKING: They have BREACHED the Capitol Building...Protestors INSIDE...LIVE RIGHT NOW,24,axolotl_peyotl,gic9vd0,t1_gic8tuj,Gibbbbb,"I'm not saying it's great or that Trump is good. Yeah, he's a fucking racist snakeoil salesmen. But at this point, all the fucking politicians  take money and the corporate oligarchs exploit us and brainwash us on propaganda, etc, all the stuff this sub has shown over the years. I'm just so fucking tired of the corruption in this country on both sides and all the corporate control. If this is how our Rome has to end, so be it.",4,gic8tuj
conspiracy,krvjzk,BREAKING: They have BREACHED the Capitol Building...Protestors INSIDE...LIVE RIGHT NOW,24,axolotl_peyotl,gig9hr6,t1_gig7y3h,A_Stagwolf_Mask,Only racists assume they're lazy. Thanks for outing yourself s racist.,3,gig7y3h
conspiracy,krvjzk,BREAKING: They have BREACHED the Capitol Building...Protestors INSIDE...LIVE RIGHT NOW,24,axolotl_peyotl,gigabuu,t1_gig9hr6,DenotheFlintstone,"Oh, I'm no racist I'm not calling black people lazy, I'm also not saying half the country was burned to the ground by black people to try to brush aside what was done yesterday by white trump supporters. Good try tho",5,gig9hr6
conspiracy,krvjzk,BREAKING: They have BREACHED the Capitol Building...Protestors INSIDE...LIVE RIGHT NOW,24,axolotl_peyotl,gigaxto,t1_gigabuu,A_Stagwolf_Mask,"White? There were black, mexican, and other minorities there as well. Holy shit, doubling down on being racist, bad look dude.",4,gigabuu
conspiracy,krvjzk,BREAKING: They have BREACHED the Capitol Building...Protestors INSIDE...LIVE RIGHT NOW,24,axolotl_peyotl,gigcvxa,t1_gigaxto,DenotheFlintstone,"As long as you stand by your statement of ""yet black rioters burned down half the country"" you have no leg to stand on when calling anyone else a racist.",12,gigaxto
PublicFreakout,17tts1o,Greta fends off right-wing agitator who rushed her on stage and grabbed her mic,370,etfvpu,k90o0z6,t1_k90lmo9,O-Victory-O,Least delusional animal abuser commented. Love the racist finish to your delusional rant. Go cry somewhere else cunt.,-9,k90lmo9
PublicFreakout,17tts1o,Greta fends off right-wing agitator who rushed her on stage and grabbed her mic,370,etfvpu,k8zn7bq,t1_k8zme3v,PublicFreakout-ModTeam,"Racism, Sexism, Homophobia, Transphobia, Harassment, Race Baiting, Bigotry, etc. (Racist/bigoted people freaking out in videos are allowed, but being a racist in the comments section will result in a ban.)",-6,k8zme3v
PublicFreakout,17tts1o,Greta fends off right-wing agitator who rushed her on stage and grabbed her mic,370,etfvpu,k8zwe9l,t1_k8zvq3e,spacemanspiff266,"you know what still baffles me? is that this man was a trekkie and *still* turned out to be a fucking racist bigot.

https://preview.redd.it/v05qvy90600c1.jpeg?width=1100&format=pjpg&auto=webp&s=ad90de352e3098cff745cb6524dd6ac0387ba25f",-5,k8zvq3e
PublicFreakout,1133u9e,Man at chilli’s acting fancy.. shaming another man in public where he can hear him on Valentines. Faith in humanity still lost.,49,[deleted],j8oyfwg,t3_1133u9e,[deleted],Lol I hate racists and biggots but for this guys sake I hope he meets one of them soon,5,1133u9e
changemyview,17yrbm5,"CMV: People who use the word ""herstory"" are fucking idiots.",69,RealFee1405,k9w2lch,t3_17yrbm5,gate18,"I love the word!

History has been told from a male point of view and the word ""herstory"" has originated as a critique to that. It was coined by Robin Morgan in 1968.

Without mixing sexism or politics, a lot of people hate the evolution of language, they hate play on words, and they think others that don't adhere to the ""standard"" are ""fucking stupid"". There are old woman, at least in United Kingdom, who write letters to different organizations when they see language not used the way it's supposed to.

So, in a way, surely you are a ""fucking idiot"" to someone else for the way you use language. **I know, you think that your objections are valid unlike those old hags**

> Using ""herstory"" is based on ignorance and stupidity and false presumptions about etymology that could easily be reversed by a Google search

Secondly, feminists (a bunch of people with a huge range of interests) aren't ignorant, **though by now even stupid people can google search**, they know what you know. So it's not what you think but it's a play on words to **highlight the actual fact** that history is written by men (and the powerful)

As with many slogans, They want you to think. In my opinion, even your rant (though it doesn't look like it) is positive. 50 people might agree with you and 1 might start to think about the way history is written.

At the end of the day, words are made up. Why was the word ""history"" taken from France? It could have been taken by anywhere else and no one would give a shit today. But surely back then, some person, said ""why should we take words from the French, which not ...""

Making up words that make people talk about the issue is genius - even if they butcher the topic at hand

Black Lives Matter vs stop killing black people. A lot of racists came of out the woodworks. A lot of people willingly prevented themselves from going beyond the slogan...  ""I've been saying it but no one believed me, Blacks are hateful. Now look, only black lives matter""

If instead they just said ""history from a woman's perspective"" - meh. 

I'm sure they were using that even before 1968. ""A room of one's own? Meh, just some women writing from a woman's perspective, they just can't stop playing the victim, they don't realize how good they have it. You know we have 10 men sleeping in the same room and she writes about a woman needing a room of her own and £500, the fucking cheek""

Herstory makes you think or rant. Better than just taking the status quo without making a sound",3,17yrbm5
changemyview,17yrbm5,"CMV: People who use the word ""herstory"" are fucking idiots.",69,RealFee1405,k9vapr2,t1_k9v74tv,UltimateTao,"Not for a good reason tho.

Progressives and liberals have been using this tactic of making noise and it's backfiring big time.

People are just becoming annoying over things that are actually important,  because the people pushing it are focusing on drawing attention and volume of opinions instead of the quality.

People (who were/are racist/sexists/etc) won't start caring about the human rights issues after liberals shout at them. It's doing the exact opposite and very successfully",-8,k9v74tv
changemyview,1c509x0,CMV: White Males Are Not Even Close To Being The Most Hated Demographic In The US ,0,dannyrules101,kzr8619,t3_1c509x0,nothing5901568,"I doubt white men are the most hated demographic, but I think prejudiced comments against them are socially acceptable in the US, so we see them more in public places than openly racist statements about other demographics.

It's socially acceptable to make disparaging comments about white men that would provoke outrage if directed at racial minorities or women.

Just to make sure my comments aren't misinterpreted, this is not intended to deny or minimize the importance of racism toward minorities and sexism.  It's also not intended to argue that racism against white men is a bigger problem than racism against other races in the US.",67,1c509x0
changemyview,1c509x0,CMV: White Males Are Not Even Close To Being The Most Hated Demographic In The US ,0,dannyrules101,kzr4j3j,t3_1c509x0,SnugglesMTG,"Coexisting with people that are different than you is an active skill, and one that white people have not usually had to practice. Generally, everyone else but them has had to adapt to differences. 

While there are some people who are just looking for an excuse to flip the table about racial dialogue because they're racist, there are a lot of white moderates who just don't have a lot of experience being in mixed company. You take a generally non-racist white guy who grew up in a rural town who has maybe seen one black person in real life his whole life and give him an internet connection and an understanding of race politics that begins and ends at ""Judge not a person by the color of their skin but the content of their character"". They see all these articles talking about how white people are this or that and at the same time you can't say that black people are like that or this, and they come to believe that it's unfair.",8,1c509x0
changemyview,1c509x0,CMV: White Males Are Not Even Close To Being The Most Hated Demographic In The US ,0,dannyrules101,kzsg4oz,t3_1c509x0,kingdomart,It’s not a competition… lmao.  Like seriously take a second to think about what you’re asking.  For example: You want to throw to the side discrimination against a particular group of people? Why is that…?  Maybe because you’re racist…,2,1c509x0
changemyview,1c509x0,CMV: White Males Are Not Even Close To Being The Most Hated Demographic In The US ,0,dannyrules101,kzrna3i,t3_1c509x0,Desalzes_,Saying any group is the most hated is impossible because how are you measuring hate? Are you going around taking surveys? It is however the most socially acceptable group to “hate” to the point of people saying you can’t be racist towards white people. No other group seems to have this racism pass,1,1c509x0
changemyview,1c509x0,CMV: White Males Are Not Even Close To Being The Most Hated Demographic In The US ,0,dannyrules101,kzstqfr,t3_1c509x0,Inspiredrationalism,"It’s true but mostly because of other white people. Nobody hates white men more then white feminists and white knight male “ allies”. The self destructive hate is just not something you see with other races, at least not openly ( example black and latino females mostly are supportive in public in their messaging about men of their shared race).

  
Combine this with the insanity that a certain subset of white people ( same people as mentioned above) also have accepted that clear insanity ( and logical fallacy) that “ black people cannot be racist vs white people” and i would say that i public terms America has turned white men into some weird evil mythical creature responsible for all the ills in society.

Now is it actively hurting white men yet, not really. The added burning is still fairly benign. But they way things are going i would say give it time.

  
Frankly it is also a little besides they point since the whole now broadly accepted “ fight racism with racism” is obviously inserting more tribalism in society and that always has disastrous consequences in  more diverse societies. Dropping universality and embracing bias is never a smart idea.",1,1c509x0
changemyview,1c509x0,CMV: White Males Are Not Even Close To Being The Most Hated Demographic In The US ,0,dannyrules101,kztoano,t3_1c509x0,Outrageous_Loquat297,"White man here. 

I’ve gotten a lot of death/violence threats walking down the street minding my own business that were from someone of another race and mention either my race or the race of the aggressor.

I’m unaware of anyone I know personally who has gotten a similar number.

When I tell other people about it, they frequently try to convince me that the explicitly racist threats I received aren’t racist OR that I need to consider and empathize with the socioeconomic factors that would lead to someone having so much violent hate for white men.

Or I have ppl coming out of the woodwork to tell me ‘that isn’t racism’ because a certain subset of ppl really like to enforce a highly specific definition of racism ONLY when the victim is white and the aggressor is not.

IMO white ppl aren’t distinct in the quantity of racism they have directed at them.  

BUT the experience of being gaslit by ppl trying to convince you that the violently racist threat just directed at you should be an opportunity to consider the feelings of the person who interrupted your day to tell you he wanted to kill you is, so far as I can tell, unique.

AND as a white guy who has experienced in person racist threats/death threats I know that if I talk about those experiences in certain crowds I’m likely to be called a racist because some ppl simply cannot accept that racism happens to people who are shaped and pigmented like me.",1,1c509x0
changemyview,1c509x0,CMV: White Males Are Not Even Close To Being The Most Hated Demographic In The US ,0,dannyrules101,kzrhzdb,t3_1c509x0,TrueMrSkeltal,"It’s considered okay and even encouraged to make racist remarks directed at white people, so it’s easy to see why that perception exists.",2,1c509x0
changemyview,1c509x0,CMV: White Males Are Not Even Close To Being The Most Hated Demographic In The US ,0,dannyrules101,kzray1z,t3_1c509x0,Coolname135,">White Males are not even close to being the most hated demographic in the US.

ESG scores & DEI are examples of widespread policies designed to create bad outcomes for white males, and all of society since they are anti meritocratic.

The field of anti racism studies is very racist and particularly anti white, and this is a field that has infiltrated much of society and indoctrinates it with anti white sentiments.

White straight males are not yet an underclass in the U.S, they are well on their way. Anti white policies have resulted in them becoming an underclass in the U.K, however.

Edit: I just noticed that I didn't put quotes around the part of my response that was the message I was responding to which might have seemed confusing.",-2,1c509x0
changemyview,1c509x0,CMV: White Males Are Not Even Close To Being The Most Hated Demographic In The US ,0,dannyrules101,kzrh0sg,t1_kzr7ko3,Sinusaur,"I think instead of ""societal"", you mean ""media"". ""Media"" is a keyword to this phenomenon, and that includes social media. ""Societal"" seems to imply some sort of collective consciousness that represents the public, and by extension, public in-person spaces. The outrage only happens in media and enforced institutions.

I'm an Asian male and growing up I've had my share of white and black dudes saying racist stuff to my face **in public** with no push back from bystanders. So by that definition and in person experiences, there is really no ""societal"" pushback against people openly making fun of other people of any other race.

IMHO. All that pushback is manufactured by the media for people who would not dare to stand up for another person being teased for their ethnicity in person.",25,kzr7ko3
changemyview,1c509x0,CMV: White Males Are Not Even Close To Being The Most Hated Demographic In The US ,0,dannyrules101,kzrhq0r,t1_kzr8619,Sinusaur,"The outrage only happens in media and enforced institutions. I'm an Asian male and growing up I've had my share of white and black dudes saying racist stuff to my face **in public** with no push back from bystanders. So by that definition and in person experiences, there is really no ""societal"" pushback against people openly making fun of other people of any other race.

If there is true public outrage, people should be ready defend one another - with prejudice being as unacceptable as an adult beating a child.

IMHO. All that pushback is manufactured by the media for people who would not dare to stand up for another person being teased for their ethnicity in person.",10,kzr8619
changemyview,1c509x0,CMV: White Males Are Not Even Close To Being The Most Hated Demographic In The US ,0,dannyrules101,kzs4m52,t1_kzrg9kd,HappyCandyCat23,"I am not sure if it's more socially acceptable to joke about white men because from what I have seen, people around me make women/minority jokes all the time with no backlash. I do see more jokes about men in some Instagram posts, but I also see plenty of men making kitchen jokes on posts by women doing random things (usually gym posts). I think for jokes it is way more dependent on your social circle and environment, which is why no one can agree what demographic is most often the butt of jokes.

However, when it comes to other forms of discrimination, white men do not face more hatred. Social media already tends to be more left leaning in general. Real life is very different. There are certain places in North America where it's common to be harassed just for being a POC/woman. This is because the hatred white men face is usually more out of jealousy or resentment due to perceived privilege, which is bad, but it doesn't lead to extremely harmful outcomes. The hatred POC face is on average much more sinister and subtle. Stereotypes about black people lead to them getting shot and searched more by police, catcalling is common for women, minority groups end up as scapegoats and get hate crimed, minority owned restaurants/shops get vandalized, looking different while taking the subway can get you harassed by mentally ill people, and more.

Overall people should start acting more mature and stop making racist/sexist jokes. It's like toilet humour, it gets boring but chronically online teenagers keep repeating them for shock value.",-5,kzrg9kd
changemyview,1c509x0,CMV: White Males Are Not Even Close To Being The Most Hated Demographic In The US ,0,dannyrules101,kzsx7ql,t1_kzs50dr,Freethinker608,"Black people are the most racist Americans, by a wide wide margin.",2,kzs50dr
changemyview,1c509x0,CMV: White Males Are Not Even Close To Being The Most Hated Demographic In The US ,0,dannyrules101,kzrjjx6,t1_kzrh0sg,Unlikely-Distance-41,"People are braver behind a keyboard, that is true. And it also depends on the audience, maybe only 1 in 100 people will actually involve themselves in someone else’s business in person, but 10 in 100 people will say something online (or something, I’m just throwing out random numbers for the scenario). 

Social media is available for everyone to see, for an unlimited amount of time (unless the post is removed), but in person, there may be very much less people witnessing a racist action in live time and a lesser amount willing to get involved in other’s business in person. 

I would also argue that our societal opinions are molded by social media. Social media makes us aware of trending issues, what the collective mind feels about something, and people are inadvertently pressured to take a stance on an issues that they otherwise wouldn’t even know about without social media. 

Imagine if the LA Riots after the Rodney King beating happened today? We would likely have widespread riots across the country like we did after the George Floyd riots and Jacob Blake riots. Social media would drive societal group think.

I also believe that Social Media DRIVES issues to become black or white, there is almost no middle ground or gray area on any issue",10,kzrh0sg
