subreddit,post_id,post_title,post_score,poster_username,comment_id,parent_id,commenter_username,comment_body,comment_score,reply_to
worldnews,1dxi27,"It turns out that Stephen Hawking’s cancelled trip to Israel is not a matter of boycotting the Jewish state, but rather merely a result of his health",245,misterAction,c9uv0p2,t3_1dxi27,usernameson,The retraction has been retracted. At this time it looks like Hawking IS taking a stand against the racist state of israel :),5,1dxi27
worldnews,3qd2ek,Wave of Violence in Israel and the Palestinian Territories,0,WorldNewsMods,cwjvym0,t1_cwed9zx,Alexi_Strife,It's clearly a home invented clock vest.  Stop being racist ,2,cwed9zx
worldnews,3qd2ek,Wave of Violence in Israel and the Palestinian Territories,0,WorldNewsMods,cwnnrd3,t1_cwn1x4s,[deleted],"""Two active-duty IDF generals who are among the army’s top experts on Palestinian affairs spoke out publicly to state that Palestinian violence is driven to a considerable degree by anger at Israeli actions. One of the two went a step further, warning that only a serious Israeli diplomatic re-engagement with the Palestinians will help to quell such violence over the long term.""

I find it really heartening that there are some voices in the IDF hierarchy speaking out with a bit of a sense.

Netanyahu is a dangerous racist who is a massive obstacle to peace. Until we get people in the Israeli leadership who accept they are a big part of the problem we'll never resolve the troubles.

Delusional Zionists who want to blame Palestinians for everything are as bad as the Islamic fundamentalists who hate Jews. If only we lived in a world without these horrible extremists incapable of seeing things from another perspective.",-16,cwn1x4s
worldnews,3qd2ek,Wave of Violence in Israel and the Palestinian Territories,0,WorldNewsMods,cwu5yr2,t1_cwu1k1k,AndyBea,">It just fundamentally comes from a place of not understanding how people respond to being dehumanized and repressed.

I don't think it comes from any ""lack of understanding"" - it comes from evil and a determination to perpetrate a new (and likely even bigger) Holocaust in the Middle East.

>Even the narrative that the settlers were willing to coexist at the founding of the nation but couldn't swing it due to Palestinian violence crumbles pretty quickly

We should be telling the world that the Zionists, since they first arrived in 1882, were intent on beating robbing and killing Palestinians from their land.

And the real fault of the Palestinians is having been much too gentle. They (or their forefathers) had 35 years (until the British arrived in 1917) to stop these stick-wielding land-grabbers.

Failure to do so is what is causing them to be so hideously punished now.

>it's clear the core issue is one of a lack of empathy for Arab people rather than historical and political ignorance (as evidenced by the fact that even being brought up to speed doesn't end the racism for those people).

What do you think of pointing to genocidal racists in history and comparing the Zionists unfavourably to them?",1,cwu1k1k
worldnews,4z6d0n,WikiLeaks outs gay people in Saudi Arabia in ‘reckless’ mass data dump,434,xbettel,d6the7v,t3_4z6d0n,[deleted],"Being gay in a Muslim country is a nightmare. We are already  being called animals, freaks, trash of humanity even some fellow peaceful Muslim  calling for a mass genocide against because they will earn more virgin if they kill us.

I'd honestly choose living next a neo nazi, racist, xenophobic over a devout Muslim any day at least I can ignore someone who is being racist to me, unlike a Muslim who wants to rape me, kill me and imprison me  for something that I didn't chose and was born this way.

",3,4z6d0n
worldnews,3pwi22,Wave of Violence in Israel and the Palestinian Territories,0,WorldNewsMods,cwdywd3,t1_cwb5hso,[deleted],"If Israel is retaining the West Bank for security reasons only, why the fuck are they continually building Jew-only settlements there?

That racist cunt Netanyahu despises Arabs. Last week the despicable bastard was blaming the Holocaust on Palestinians. The guy is sick in the head. Nothing he says should ever be trusted. Israelis should ashamed to have that scumbag as Prime Minister.

For your information there were no rockets fired from Gaza for two years prior to the previous conflcit as Hamas respected the ceasefire. It was only after intense provocation did the rockets start again, so this idea that Palestinians crave violence and will always attack Israel is fucking bullshit.",1,cwb5hso
worldnews,3pwi22,Wave of Violence in Israel and the Palestinian Territories,0,WorldNewsMods,cwd1tft,t1_cwcq5hx,johannL,"> The Israelis can obtain their objective through peace because peace is their objective.

Right, hence the settlements.

edit for more snark:

It also explains why Rabin was murdered by Palestinian extremists and not right-wing Israelis. It explains why [the Palestinians attack so much](http://visualizingpalestine.org/visuals/gaza-ceasefire-violations) and force Israeli forces to shell kids on beaches, or to flatten whole blocks and a hospital. Palestinians use human shields, you see, the Hannibal directive has nothing to do with it ever, and don't ask for sources either, while ignoring the instances of the IDF forcing families to stay in houses they occupy. They spray skunk water to calm people down, and they ""map"" the population by having everybody get up in the middle of the night to be photographed to give people a sense of what it's like to have dignity. [Undercover agents throwing stones](http://972mag.com/watch-israeli-undercover-agents-shoot-unarmed-boy-at-point-blank-range/112474/) are really the only way to blend in with these hateful Palestinians.

And of coures, people like [Stav Shaffir](https://www.youtube.com/watch?v=3I3Pwjyt8bM) or [Max Blumenthal](http://www.alternet.org/world/painting-palestinians-nazis-netanyahu-incites-wave-vigilante-violence) are just full of it, anyway. They just hate those Israelis who want nothing but annex land peacefully. Noam Chomsky and Normal Finkelstein obviousy loathe themselves, and so on.

Seriously though, the people who dream of ""Greater Israel"" and the people who want to ""free ALL Palestine"" as they euphemistically put it, are two sides of the same coin, and they feed off each other. Peace has nothing to do with it. And I agree, neither does stabbing people have to do with ""resistance"", when I say two sides of the same coin I mean that. But when two people fuck up, and you all group around one of them and declare the other a saint, then even regardless of who occupies who and military power, it's just common decency to concentrate on what is being glossed over, not so much on what everybody and their dog is parroting already. It's not like I'm not familiar with PalWatch and what they point out, or distorted or faked stuff AKA ""Pallywood"", and how people just pass that on without thinking. That's all gross and stupid and reckless, and no doubt often racist. It certainly proudly displays tribal thinking, one group good, other bad, to be exaggerated infinitely.

But neither of the crimes and BS in certain camps on each ""side"" excuse the other else. If you think one side is pure you're on crack. The people on each side who are for human rights and international law are the closest to that, but they don't exactly get much attention now do they. People prefer to talk about the ""antisemitic Islamofascists"" or the ""child eating Zionazis"", shades of grey are for traitors.",-2,cwcq5hx
worldnews,3pwi22,Wave of Violence in Israel and the Palestinian Territories,0,WorldNewsMods,cwammfk,t1_cwaireo,[deleted],"It is obviously against the law for people of any ethnicity to live in certain places in the world. It is illegal for a prisoner to live anywhere other than his prison. Is that racist too? 

Seriously, how much are you trolls going to play the race card? Do you think it is helping to make such a godawful case outside of the internet? Do you think the English-speaking audience who reads this kind of victim playing is going to be convinced? 

It is illegal for Israeli citizens to live in any area that Israel confiscates by force or keeps under military occupation. That is true for any country. If the United States had begun building large civilian settlements for US citizens in Iraq it would also have been illegal.",-2,cwaireo
worldnews,3pwi22,Wave of Violence in Israel and the Palestinian Territories,0,WorldNewsMods,cwannxv,t1_cwammfk,Zenarchist,">It is illegal for a prisoner to live anywhere other than his prison. Is that racist too?

Prisoners are a race in your world? Strange world.",3,cwammfk
worldnews,3pwi22,Wave of Violence in Israel and the Palestinian Territories,0,WorldNewsMods,cwanq80,t1_cwammfk,slaugh85,">It is obviously against the law for people of any ethnicity to live in certain places in the world. It is illegal for a prisoner to live anywhere other than his prison. Is that racist too? 

Lol what? No it's not. That's called persecution. What a ridiculous thing to say.

>Seriously, how much are you trolls going to play the race card? 

If you don't think this whole issue is about race and ethnicity, I don't think you understand what is happening.



",0,cwammfk
worldnews,3pwi22,Wave of Violence in Israel and the Palestinian Territories,0,WorldNewsMods,cwanqna,t1_cwannxv,[deleted],"No, they aren't, but neither are ""settlers"", and OP seems to think that removing them is racist. What a crock of shit. ",-2,cwannxv
worldnews,3rxvjg,Wave of Violence in Israel and the West Bank,0,WorldNewsMods,cwwt3jf,t1_cwwn8y6,OccamsRifle,"It's that combined with bigotry of low expectations. 

Basically racism that they won't admit is being racist ",19,cwwn8y6
worldnews,3rxvjg,Wave of Violence in Israel and the West Bank,0,WorldNewsMods,cwx8anj,t1_cwx7ksi,[deleted],"The international community considers all Israeli settlements in the Palestinian territories illegal under international law.

You're occupying another people's land supposedly for security reasons so why the fuck are you building settlements for you own people? It's outrageous.

If the settlements are destroyed and Israel moves its forces to the edge of the West Bank, clearly things are going to drastically improve in terms of relations.

Bringing your children up to act as martyrs is obviously a terrible thing to do. My point is, these settlers have the opportunity to live in Israel away from angry Palestinians, who are being denied basic human rights. The Palestinians do not have the opportunity to move away from the IDF and the settlers.

Unfortunately a lot of the settlers are racist ultra-religious nutjobs intent on stealing Palestinian land for themselves. The government need to forcibly remove them but instead they protect them.

The problem the world has is that as long as the Americans support the abuse of Palestinians, Israel will continue to take the piss.",-7,cwx7ksi
worldnews,3rxvjg,Wave of Violence in Israel and the West Bank,0,WorldNewsMods,cwy0e0u,t1_cwxytfa,[deleted],"So somebody is suspected of carrying out a stabbing and you think that suspicion is as good as a guilty verdict. It's like being back in the fucking Wild West.

You've got to remember a lot of these IDF soldiers are racists with guns. Giving them free rein to murder Arabs they don't like the look of is not really what you expect from a civilised country.",-6,cwxytfa
worldnews,3rxvjg,Wave of Violence in Israel and the West Bank,0,WorldNewsMods,cwy1er6,t1_cwy0e0u,AssButtMongrel,"He's *suspected* in the sense that he should go on trial; but there's damning evidence that he's the perpetrator. This is not some conspiracy, and soldiers don't risk their lives to arrest some random dude.

I'm an ex-IDF soldier myself. Paratrooper. We do not have ""free rein to murder Arabs"", our protocols for opening fire are extremely harsh. Every bullet is accounted for. If you opened fire for no reason and without risk to you or your friend's life- even if you didn't hit anything: you are probably going to jail.

We're kids out to protect their moms and dads. Children are used to scout us out, women are strapped with bombs and are sent running at us to blow us up. Children are told to cry in ambushes for us to follow and die. This is first-hand account, from me to you my friend.

If an IDF soldier shot someone, it is probably extremely documented and thoroughly investigated; which can't be said of many other armies in the world. While I'm sure we have many racists (as I believe almost all of the world population is racist in some way), I also think you can't easily find a military more moral than the IDF; despite what some would like to have you believe. I hope you don't laugh at this or think I'm delusional or brain washed or something: but we're good guys.",15,cwy0e0u
worldnews,3rxvjg,Wave of Violence in Israel and the West Bank,0,WorldNewsMods,cwxn128,t1_cwtsd37,ecmdome,"This is exactly the root of the problem.

You are making such a general and false statement.  ""Israelis hate arabs""... that can't be further from the truth.

Yes there are racist Israelis, and racism in Israel may even be on the rise in the recent years(I honestly don't know, but it wouldn't surprise me).

The current wave of violence may be targeted towards non-racist Israelis who are pushing for a two-state solution... but you would never know because the victims are innocent people.

If the Palestinians would stop the attacks, move towards a majority of peaceful protests and movements within their territories.  If they would use the media and internet to rally support in a peaceful manner, if they would sit down at the negotiating table and accept STEPS towards a peaceful solution... I think the picture would be much different.",1,cwtsd37
worldnews,s6leah,"Omicron cases in Beijing, Shenzhen suspected of links to packages from North America",0,Pillowtalk,ht4ndox,t1_ht4dibx,DreamsRising,"> Meanwhile if you talk about the truth you'll be banned for misinformation.


That’s absolute bullshit. All over Reddit, people post unsubstantiated claims all the damn time without sources, or very often with crude sources that only suit their narrative. 


Though we do see *subreddits* being closed these days - notably the recent closure of /r/NoNewNormal which was essentially COVID conspiracists banding together to spread misinformation. Whilst the *subreddit* was closed, the users are still around.",7,ht4dibx
news,2bl8d7,ISIS orders all women and girls in Mosul to undergo Female Genital Mutilation,348,rahulthewall,cj7797m,t1_cj6fcg2,[deleted],"You know, sometimes it is satisfying to see the racism of a group of people who generally pride themselves on being anti-racist.",1,cj6fcg2
news,1vxp05,Justin Bieber Arrested for Drag Racing / DUI (Miami),744,S_E_G_A,cex09lm,t1_cex01ny,thebizarrojerry,Weekends and holidays are nothing but submission after submission from racists and the mods all laugh while placing them on the front page. Not just against Jews (disguised as hatred of Israel as usual) but venom spewed when the topic of Islam comes up. It's just an entire subreddit of hate.,2,cex01ny
news,17cmrby,Jewish organisations call to boycott Starbucks over union's support of Hamas,7,GennyCD,k5rijrn,t1_k5rhdoh,paranrml-inactivity,"Here’s how I see it
Judaism = religion
Zionism = political philosophy.  
Israel |Palestine = Nation states

If you don’t like Jews you are a racist
If you don’t like Zionism you don’t like a 19th century solution to a 21st century problem 
If you don’t like Israel or Palestine welp, I can’t do anything to help you—neither are going anywhere any time soon.  

If you are from Canada like me—you should probably spend more time working on the oppression of our indigenous people whose land you are squatting on rn

Edit: formatting",10,k5rhdoh
news,1xyegt,Actress Ellen Page has come out as a lesbian,1090,makedomend,cffx992,t1_cffsggl,Slambusher,Depends on the way folks were brought up. I've lived in rural Illinois and its one of the most racist and homophobic places I've ever seen. I now live in rural Ga and even the true 'necks here could give a shit less if your gay so long as you don't hit on them. Here I thought that as bad as Illinois was Georgia would be so much worse and really GA is a hotbed of acceptance.,3,cffsggl
news,ld5zg9,Man who wore horns in Capitol riot moved to Virginia jail that serves organic food,26,suitcaseofballots,gm4eq3m,t3_ld5zg9,CheekyFlapjack,"The lengths that racist white people in the US go to protect their own, criminal terrorists is fucking sickening..",2,ld5zg9
